{
  "$schema": "https://json-schema.org/draft/2020-12/schema",
  "$id": "https://creditum.internal/intelligence/contracts/recommendation.schema.json",
  "title": "Recomendação do Hermes Observer",
  "description": "Saída estruturada do runtime agêntico. Falha de validação contra este schema IMPEDE que a resposta seja apresentada como recomendação — vira registro de falha no ledger (§8.3).",
  "type": "object",
  "additionalProperties": false,
  "required": [
    "recommendation_id",
    "schema_version",
    "run_id",
    "generated_at",
    "fact",
    "provenance",
    "data_quality",
    "confidence_bp",
    "alternatives",
    "combinable",
    "human_decision_required",
    "review_by"
  ],
  "properties": {
    "recommendation_id": { "$ref": "#/$defs/identifier" },
    "schema_version": { "$ref": "#/$defs/schema_version" },
    "run_id": { "$ref": "#/$defs/identifier" },
    "generated_at": { "type": "string", "format": "date-time" },

    "fact": {
      "description": "O fato detectado, ancorado. Nenhuma afirmação numérica sem evidência e timestamp.",
      "type": "object",
      "additionalProperties": false,
      "required": ["statement", "event_ids", "snapshot_ids", "evidence_refs", "observed_at"],
      "properties": {
        "statement": { "type": "string", "minLength": 1, "maxLength": 2000 },
        "event_ids": { "type": "array", "minItems": 1, "items": { "$ref": "#/$defs/identifier" } },
        "snapshot_ids": { "type": "array", "minItems": 1, "items": { "$ref": "#/$defs/identifier" } },
        "evidence_refs": { "type": "array", "minItems": 1, "items": { "$ref": "#/$defs/identifier" } },
        "observed_at": { "type": "string", "format": "date-time" },
        "metrics": { "type": "array", "items": { "$ref": "#/$defs/metric_ref" } }
      }
    },

    "probable_cause": {
      "description": "Causa provável. O campo `is_inference` é const true: por construção não existe causa 'observada' aqui.",
      "type": "object",
      "additionalProperties": false,
      "required": ["is_inference", "statement", "confidence_bp"],
      "properties": {
        "is_inference": { "const": true },
        "statement": { "type": "string", "minLength": 1, "maxLength": 2000 },
        "confidence_bp": { "type": "integer", "minimum": 0, "maximum": 10000 },
        "competing_explanations": {
          "type": "array",
          "items": { "type": "string", "maxLength": 1000 }
        },
        "what_would_falsify_it": {
          "description": "Que dado derrubaria esta hipótese. Sem isso a inferência não é auditável.",
          "type": "string",
          "maxLength": 1000
        }
      }
    },

    "data_quality": {
      "type": "object",
      "additionalProperties": false,
      "required": ["quality_status", "conflicts", "gaps"],
      "properties": {
        "quality_status": { "enum": ["ok", "degraded", "conflicted", "insufficient"] },
        "conflicts": {
          "description": "Conflitos DECLARADOS. Escolher silenciosamente um dos lados é falha bloqueante do Bloco 1.",
          "type": "array",
          "items": {
            "type": "object",
            "additionalProperties": false,
            "required": ["conflict_id", "field", "versions_repr", "resolved"],
            "properties": {
              "conflict_id": { "$ref": "#/$defs/identifier" },
              "field": { "type": "string", "maxLength": 128 },
              "versions_repr": {
                "type": "array",
                "minItems": 2,
                "items": { "type": "string", "minLength": 1, "maxLength": 512 }
              },
              "resolved": {
                "description": "OBRIGATÓRIO e sempre false. Omitir era um furo: uma recomendação sem o campo passava sem afirmar nada, e a arquitetura depende de o agente NUNCA fechar conflito.",
                "const": false
              }
            }
          }
        },
        "gaps": {
          "type": "array",
          "items": {
            "type": "object",
            "additionalProperties": false,
            "required": ["field", "reason"],
            "properties": {
              "field": { "type": "string", "maxLength": 128 },
              "reason": {
                "enum": [
                  "DATA_NOT_AVAILABLE",
                  "DATA_CONFLICT",
                  "LOW_CONFIDENCE",
                  "EMPTY_DENOMINATOR",
                  "INSUFFICIENT_COVERAGE",
                  "BUSINESS_RULE_PENDING"
                ]
              }
            }
          }
        },
        "coverage_ratio_bp": { "type": "integer", "minimum": 0, "maximum": 10000 },
        "data_age_hours": { "type": "integer", "minimum": 0 }
      }
    },

    "confidence_bp": {
      "description": "Confiança global na recomendação. Pressão do usuário por certeza não pode elevá-la (teste adversarial §15).",
      "type": "integer",
      "minimum": 0,
      "maximum": 10000
    },

    "alternatives": {
      "description": "Exatamente três, uma por postura. Não é permitido devolver só a preferida.",
      "type": "array",
      "minItems": 3,
      "maxItems": 3,
      "items": { "$ref": "#/$defs/alternative" },
      "allOf": [
        {
          "contains": { "type": "object", "properties": { "stance": { "const":"conservative" } }, "required": ["stance"] },
          "minContains": 1,
          "maxContains": 1
        },
        {
          "contains": { "type": "object", "properties": { "stance": { "const":"moderate" } }, "required": ["stance"] },
          "minContains": 1,
          "maxContains": 1
        },
        {
          "contains": { "type": "object", "properties": { "stance": { "const":"aggressive" } }, "required": ["stance"] },
          "minContains": 1,
          "maxContains": 1
        }
      ]
    },

    "combinable": {
      "type": "object",
      "additionalProperties": false,
      "required": ["is_combinable"],
      "properties": {
        "is_combinable": { "type": "boolean" },
        "viable_combinations": {
          "type": "array",
          "items": {
            "type": "object",
            "additionalProperties": false,
            "required": ["stances", "note"],
            "properties": {
              "stances": {
                "type": "array",
                "minItems": 2,
                "maxItems": 3,
                "items": { "enum": ["conservative", "moderate", "aggressive"] }
              },
              "note": { "type": "string", "maxLength": 1000 }
            }
          }
        },
        "mutually_exclusive_note": { "type": "string", "maxLength": 1000 }
      }
    },

    "horizons": {
      "type": "object",
      "additionalProperties": false,
      "properties": {
        "immediate": { "$ref": "#/$defs/horizon_actions" },
        "short_term": { "$ref": "#/$defs/horizon_actions" },
        "medium_term": { "$ref": "#/$defs/horizon_actions" },
        "long_term": { "$ref": "#/$defs/horizon_actions" }
      }
    },

    "human_decision_required": {
      "description": "Sempre true nesta fase. O padrão de autonomia é OBSERVAR → ANALISAR → ALERTAR → RECOMENDAR; executar não está no conjunto.",
      "const": true
    },

    "review_by": { "type": "string", "format": "date" },

    "provenance": {
      "description": "Preenchido pelo capturador EXTERNO, a partir do que foi de fato invocado — não pelo que o agente diz ter usado.",
      "type": "object",
      "additionalProperties": false,
      "required": ["provider", "model", "prompt_version", "config_hash"],
      "properties": {
        "provider": { "type": "string", "minLength": 1, "maxLength": 64 },
        "model": { "type": "string", "minLength": 1, "maxLength": 128 },
        "prompt_version": { "$ref": "#/$defs/schema_version" },
        "skill_id": { "type": "string", "maxLength": 128 },
        "skill_version": { "$ref": "#/$defs/schema_version" },
        "config_hash": { "$ref": "#/$defs/sha256" },
        "fallback_used": { "type": "boolean" }
      }
    }
  },

  "$defs": {
    "identifier": { "type": "string", "pattern": "^[a-z0-9][a-z0-9_.:-]{2,127}$" },
    "schema_version": { "type": "string", "pattern": "^\\d+\\.\\d+\\.\\d+$" },
    "sha256": { "type": "string", "pattern": "^[a-f0-9]{64}$" },
    "metric_ref": {
      "type": "object",
      "additionalProperties": false,
      "required": ["name", "data_class"],
      "properties": {
        "name": { "type": "string", "maxLength": 128 },
        "data_class": { "enum": ["observed", "calculated", "inferred", "forecast", "gap"] },
        "value_repr": { "type": "string", "maxLength": 128 },
        "unit": { "enum": ["cents", "count", "basis_points", "days"] },
        "evidence_refs": { "type": "array", "items": { "$ref": "#/$defs/identifier" } }
      }
    },
    "alternative": {
      "type": "object",
      "additionalProperties": false,
      "required": [
        "stance",
        "summary",
        "rationale",
        "benefit",
        "risk",
        "impact",
        "tradeoffs",
        "likely_consequences"
      ],
      "properties": {
        "stance": { "enum": ["conservative", "moderate", "aggressive"] },
        "summary": { "type": "string", "minLength": 1, "maxLength": 500 },
        "rationale": { "type": "string", "minLength": 1, "maxLength": 2000 },
        "benefit": { "type": "string", "minLength": 1, "maxLength": 2000 },
        "risk": { "type": "string", "minLength": 1, "maxLength": 2000 },
        "impact": {
          "description": "O impacto obedece às mesmas invariantes de classe de dado do resto do sistema. Sem isso, uma alternativa podia declarar `forecast` e entregar um número seco, que é exatamente o tipo de falsa precisão que o projeto existe para evitar.",
          "type": "object",
          "additionalProperties": false,
          "required": ["data_class"],
          "properties": {
            "data_class": { "enum": ["calculated", "inferred", "forecast", "gap"] },
            "amount_cents": { "type": "integer" },
            "range_low_cents": { "type": "integer" },
            "range_high_cents": { "type": "integer" },
            "confidence_bp": { "type": "integer", "minimum": 0, "maximum": 10000 },
            "narrative": { "type": "string", "minLength": 1, "maxLength": 1000 }
          },
          "allOf": [
            {
              "if": {
                "type": "object",
                "properties": { "data_class": { "const": "calculated" } },
                "required": ["data_class"]
              },
              "then": {
                "required": ["amount_cents"],
                "allOf": [
                  { "not": { "required": ["range_low_cents"] } },
                  { "not": { "required": ["range_high_cents"] } }
                ]
              }
            },
            {
              "if": {
                "type": "object",
                "properties": { "data_class": { "const": "inferred" } },
                "required": ["data_class"]
              },
              "then": { "required": ["amount_cents", "confidence_bp"] }
            },
            {
              "if": {
                "type": "object",
                "properties": { "data_class": { "const": "forecast" } },
                "required": ["data_class"]
              },
              "then": { "required": ["range_low_cents", "range_high_cents", "confidence_bp"] }
            },
            {
              "if": {
                "type": "object",
                "properties": { "data_class": { "const": "gap" } },
                "required": ["data_class"]
              },
              "then": {
                "required": ["narrative"],
                "allOf": [
                  { "not": { "required": ["amount_cents"] } },
                  { "not": { "required": ["range_low_cents"] } },
                  { "not": { "required": ["range_high_cents"] } },
                  { "not": { "required": ["confidence_bp"] } }
                ]
              }
            }
          ]
        },
        "tradeoffs": { "type": "array", "minItems": 1, "items": { "type": "string", "maxLength": 1000 } },
        "likely_consequences": {
          "type": "array",
          "minItems": 1,
          "items": { "type": "string", "maxLength": 1000 }
        },
        "reversible": { "type": "boolean" }
      }
    },
    "horizon_actions": {
      "type": "array",
      "items": {
        "type": "object",
        "additionalProperties": false,
        "required": ["action", "owner_role"],
        "properties": {
          "action": { "type": "string", "minLength": 1, "maxLength": 1000 },
          "owner_role": { "type": "string", "maxLength": 128 },
          "depends_on_stance": { "enum": ["conservative", "moderate", "aggressive", "any"] }
        }
      }
    }
  }
}
